{
  "model": "htdemucs",
  "mse_threshold": 0.0001,
  "onnx_path": "models/htdemucs.spectral.published.onnx",
  "results": [
    {
      "category": "silence",
      "expected_shape": [
        1,
        4,
        2,
        343980
      ],
      "expected_shape_match": true,
      "fixture_id": "synth-silence-343980",
      "mae": 0.0,
      "max_abs_error": 0.0,
      "mse": 0.0,
      "mse_threshold": 0.0001,
      "onnx_has_inf": false,
      "onnx_has_nan": false,
      "onnx_output_digest": "a999206a068d229167e9d24600b770c37d0483b8e03e84875960dd217cc5a8e4",
      "onnx_shape": [
        1,
        4,
        2,
        343980
      ],
      "pytorch_has_inf": false,
      "pytorch_has_nan": false,
      "pytorch_output_digest": "a999206a068d229167e9d24600b770c37d0483b8e03e84875960dd217cc5a8e4",
      "pytorch_shape": [
        1,
        4,
        2,
        343980
      ],
      "shape_match": true,
      "tier": "pr"
    },
    {
      "category": "noise",
      "expected_shape": [
        1,
        4,
        2,
        343980
      ],
      "expected_shape_match": true,
      "fixture_id": "synth-noise-343980",
      "mae": 3.7116302796823774e-06,
      "max_abs_error": 4.795566201210022e-05,
      "mse": 3.4690287448012215e-11,
      "mse_threshold": 0.0001,
      "onnx_has_inf": false,
      "onnx_has_nan": false,
      "onnx_output_digest": "70f16f392c3581d0fba288437bb43a80aa02632740911efff617e00d135ddf20",
      "onnx_shape": [
        1,
        4,
        2,
        343980
      ],
      "pytorch_has_inf": false,
      "pytorch_has_nan": false,
      "pytorch_output_digest": "3818761a0995923df3d4fdef0667cc01a87d8af3a146e830c3b7784e520d3fc1",
      "pytorch_shape": [
        1,
        4,
        2,
        343980
      ],
      "shape_match": true,
      "tier": "pr"
    },
    {
      "category": "sine-sweep",
      "expected_shape": [
        1,
        4,
        2,
        343980
      ],
      "expected_shape_match": true,
      "fixture_id": "synth-sine-sweep-343980",
      "mae": 3.933948768067046e-05,
      "max_abs_error": 0.004901707172393799,
      "mse": 2.6276203806594686e-08,
      "mse_threshold": 0.0001,
      "onnx_has_inf": false,
      "onnx_has_nan": false,
      "onnx_output_digest": "bb7267e8703869791bcb97d9a210fa63f701a651aa9ad0408803b78ba59845cb",
      "onnx_shape": [
        1,
        4,
        2,
        343980
      ],
      "pytorch_has_inf": false,
      "pytorch_has_nan": false,
      "pytorch_output_digest": "37fb388338fbfef201e4300042a5c61bbf01c23eb22edd7bf6c31493ffd30562",
      "pytorch_shape": [
        1,
        4,
        2,
        343980
      ],
      "shape_match": true,
      "tier": "pr"
    },
    {
      "category": "multitone",
      "expected_shape": [
        1,
        4,
        2,
        343980
      ],
      "expected_shape_match": true,
      "fixture_id": "synth-multitone-343980",
      "mae": 4.4160313998060167e-07,
      "max_abs_error": 1.3541430234909058e-05,
      "mse": 4.816860538928445e-13,
      "mse_threshold": 0.0001,
      "onnx_has_inf": false,
      "onnx_has_nan": false,
      "onnx_output_digest": "c1109ab734fdbeb1aac155d9e0f71452159ac44143b977efa6dccaf3b77f8b21",
      "onnx_shape": [
        1,
        4,
        2,
        343980
      ],
      "pytorch_has_inf": false,
      "pytorch_has_nan": false,
      "pytorch_output_digest": "2edbbfb48d88839c12e23a8761abd737e8c8bc1a5bd16ceea4d893e687cb7b50",
      "pytorch_shape": [
        1,
        4,
        2,
        343980
      ],
      "shape_match": true,
      "tier": "pr"
    },
    {
      "category": "impulse",
      "expected_shape": [
        1,
        4,
        2,
        343980
      ],
      "expected_shape_match": true,
      "fixture_id": "synth-impulse-343980",
      "mae": 0.00013979912029997373,
      "max_abs_error": 2.8781208842992783,
      "mse": 0.00010302034206710075,
      "mse_threshold": 0.0002,
      "onnx_has_inf": false,
      "onnx_has_nan": false,
      "onnx_output_digest": "c07e6b72058c4a511b27cff2686759bb5828bba5bd617179631ddc06ba3e67f6",
      "onnx_shape": [
        1,
        4,
        2,
        343980
      ],
      "pytorch_has_inf": false,
      "pytorch_has_nan": false,
      "pytorch_output_digest": "dbb260819e55126442aefe16829224f6b2d3e5c8b32bfbd51f47d93e24ac0575",
      "pytorch_shape": [
        1,
        4,
        2,
        343980
      ],
      "shape_match": true,
      "tier": "pr"
    },
    {
      "category": "chunk-boundary",
      "expected_shape": [
        1,
        4,
        2,
        687960
      ],
      "expected_shape_match": true,
      "fixture_id": "synth-chunk-boundary-687960",
      "mae": 1.2500043725150988e-06,
      "max_abs_error": 1.6169622540473938e-05,
      "mse": 5.902691425324354e-12,
      "mse_threshold": 0.0001,
      "onnx_has_inf": false,
      "onnx_has_nan": false,
      "onnx_output_digest": "c49342556877f64652d63ea8650e06b11c43d8b711778245b25d0e6ccbfab746",
      "onnx_shape": [
        1,
        4,
        2,
        687960
      ],
      "pytorch_has_inf": false,
      "pytorch_has_nan": false,
      "pytorch_output_digest": "35154feeac5b8eabfa79cd6d5edf66cf4f45bc68e05c387956d991b5614af601",
      "pytorch_shape": [
        1,
        4,
        2,
        687960
      ],
      "shape_match": true,
      "tier": "pr"
    },
    {
      "category": "clipping",
      "expected_shape": [
        1,
        4,
        2,
        343980
      ],
      "expected_shape_match": true,
      "fixture_id": "synth-clipping-343980",
      "mae": 1.6096262375917643e-05,
      "max_abs_error": 0.00019592046737670898,
      "mse": 6.447519778738864e-10,
      "mse_threshold": 0.0001,
      "onnx_has_inf": false,
      "onnx_has_nan": false,
      "onnx_output_digest": "b14c14edb39c2e5189f21769812878590f855ffabc533f4dd3bfa0edcf596a36",
      "onnx_shape": [
        1,
        4,
        2,
        343980
      ],
      "pytorch_has_inf": false,
      "pytorch_has_nan": false,
      "pytorch_output_digest": "c127df39a21997c62d3a1072482f4c889bb9c843587704bc88581c37aed1ca3a",
      "pytorch_shape": [
        1,
        4,
        2,
        343980
      ],
      "shape_match": true,
      "tier": "pr"
    },
    {
      "category": "low-level",
      "expected_shape": [
        1,
        4,
        2,
        343980
      ],
      "expected_shape_match": true,
      "fixture_id": "synth-low-level-343980",
      "mae": 3.703481603234655e-07,
      "max_abs_error": 4.780478775501251e-06,
      "mse": 3.4497564005691127e-13,
      "mse_threshold": 0.0001,
      "onnx_has_inf": false,
      "onnx_has_nan": false,
      "onnx_output_digest": "4671a24426dfc840bb51f6f63cab23c289a595fd2d14f596b08332648c974446",
      "onnx_shape": [
        1,
        4,
        2,
        343980
      ],
      "pytorch_has_inf": false,
      "pytorch_has_nan": false,
      "pytorch_output_digest": "7ae526fb1c57265b94f1ca1fa306d7166192c1a3301edcff92071e41f5eae191",
      "pytorch_shape": [
        1,
        4,
        2,
        343980
      ],
      "shape_match": true,
      "tier": "pr"
    },
    {
      "category": "channel-imbalance",
      "expected_shape": [
        1,
        4,
        2,
        343980
      ],
      "expected_shape_match": true,
      "fixture_id": "synth-channel-imbalance-343980",
      "mae": 3.555007160125961e-06,
      "max_abs_error": 4.982948303222656e-05,
      "mse": 3.127890059226485e-11,
      "mse_threshold": 0.0001,
      "onnx_has_inf": false,
      "onnx_has_nan": false,
      "onnx_output_digest": "f3d773d9e8326e931c4a184f16b5e26ef2c1171bcc8cb630aaef3251a964e764",
      "onnx_shape": [
        1,
        4,
        2,
        343980
      ],
      "pytorch_has_inf": false,
      "pytorch_has_nan": false,
      "pytorch_output_digest": "754ccde5822d72067688a4412e224b5d4f41475ec524e5c441fe7b770d53da8e",
      "pytorch_shape": [
        1,
        4,
        2,
        343980
      ],
      "shape_match": true,
      "tier": "pr"
    }
  ],
  "schema_version": "openkara.quality-report/v1",
  "tier": "pr"
}
